{
  "$schema": "http://json-schema.org/draft-07/schema#",
  "$id": "rawantv://schemas/player.json",
  "title": "Player",
  "type": "object",
  "required": ["id", "name"],
  "properties": {
    "id":          { "type": "string", "pattern": "^player_[a-z0-9_]+$" },
    "name":        { "type": "string" },
    "position":    { "type": ["string", "null"] },
    "nationality": { "type": ["string", "null"] },
    "birth_date":  { "type": ["string", "null"], "format": "date" },
    "height":      { "type": ["integer", "null"] },
    "weight":      { "type": ["integer", "null"] },
    "club_id":     { "type": ["string", "null"] },
    "photo":       { "type": ["string", "null"], "format": "uri" },
    "statistics": {
      "type": "object",
      "properties": {
        "goals":   { "type": "integer", "minimum": 0 },
        "assists": { "type": "integer", "minimum": 0 },
        "matches": { "type": "integer", "minimum": 0 }
      }
    },
    "sources": {
      "type": "object",
      "additionalProperties": { "type": "string" }
    }
  },
  "additionalProperties": false
}
