{
  "id": "player_abdoulaye_faye",
  "name": "Abdoulaye Faye",
  "position": "Defender",
  "nationality": "Senegal",
  "birth_date": "1978-02-26",
  "height": 1,
  "weight": 85,
  "club_id": "team_lorient",
  "photo": "https://r2.thesportsdb.com/images/media/player/thumb/1nqjvb1708945668.jpg",
  "statistics": {
    "goals": 0,
    "assists": 0,
    "matches": 0
  },
  "sources": {
    "thesportsdb": "34145874"
  }
}