{
  "id": "player_aaron_wan_bissaka",
  "name": "Aaron Wan-Bissaka",
  "position": "Right-Back",
  "nationality": "DR Congo",
  "birth_date": "1997-06-26",
  "height": 6,
  "weight": 72,
  "club_id": "team_aston_villa",
  "photo": "https://r2.thesportsdb.com/images/media/player/thumb/rqm6nx1772134170.jpg",
  "statistics": {
    "goals": 0,
    "assists": 0,
    "matches": 0
  },
  "sources": {
    "thesportsdb": "34167575"
  }
}