{
  "id": "player_fabio_miretti",
  "name": "Fabio Miretti",
  "position": "Midfielder",
  "nationality": "Italy",
  "birth_date": "2003-08-03",
  "height": 1,
  "weight": 163,
  "club_id": "team_juventus",
  "photo": "https://r2.thesportsdb.com/images/media/player/thumb/8mdf8y1679483557.jpg",
  "statistics": {
    "goals": 0,
    "assists": 0,
    "matches": 0
  },
  "sources": {
    "thesportsdb": "34195099"
  }
}