{
  "id": "player_igor_julio",
  "name": "Igor Julio",
  "position": "Centre-Back",
  "nationality": "Brazil",
  "birth_date": "1998-02-07",
  "height": 1,
  "weight": 185,
  "club_id": "team_brighton_and_hove_albion",
  "photo": "https://r2.thesportsdb.com/images/media/player/thumb/8th0n11580503642.jpg",
  "statistics": {
    "goals": 0,
    "assists": 0,
    "matches": 0
  },
  "sources": {
    "thesportsdb": "34169537"
  }
}