{
  "id": "player_caleb_kporha",
  "name": "Caleb Kporha",
  "position": "Defender",
  "nationality": "England",
  "birth_date": "2006-07-15",
  "height": 1,
  "weight": 67,
  "club_id": "team_crystal_palace",
  "photo": "https://r2.thesportsdb.com/images/media/player/thumb/t1sgyq1752343356.jpg",
  "statistics": {
    "goals": 0,
    "assists": 0,
    "matches": 0
  },
  "sources": {
    "thesportsdb": "34258537"
  }
}