{
  "id": "player_didier_digard",
  "name": "Didier Digard",
  "position": "Manager",
  "nationality": "France",
  "birth_date": "1986-07-12",
  "height": 1,
  "weight": 76,
  "club_id": "team_le_havre",
  "photo": "https://r2.thesportsdb.com/images/media/player/thumb/8rmwpq1681391214.jpg",
  "statistics": {
    "goals": 0,
    "assists": 0,
    "matches": 0
  },
  "sources": {
    "thesportsdb": "34152832"
  }
}